{
  "$schema": "https://json-schema.org/draft/2020-12/schema",
  "$id": "https://msp.local/schema/site-definition.schema.json",
  "title": "Site definition (M0 minimal subset, ADR-0034)",
  "type": "object",
  "required": [
    "meta",
    "pages",
    "ctas",
    "forms",
    "navigation",
    "footer",
    "tracking"
  ],
  "additionalProperties": false,
  "properties": {
    "$schema": {
      "type": "string"
    },
    "meta": {
      "type": "object",
      "required": [
        "schema_version",
        "client",
        "site_url",
        "theme",
        "default_language",
        "languages",
        "version"
      ],
      "additionalProperties": false,
      "properties": {
        "schema_version": {
          "const": 1
        },
        "client": {
          "$ref": "#/$defs/slug"
        },
        "site_url": {
          "type": "string",
          "pattern": "^https://[^/]+$"
        },
        "theme": {
          "type": "string",
          "minLength": 1
        },
        "default_language": {
          "$ref": "#/$defs/language"
        },
        "languages": {
          "type": "array",
          "items": {
            "$ref": "#/$defs/language"
          },
          "minItems": 1,
          "uniqueItems": true
        },
        "version": {
          "type": "string",
          "pattern": "^\\d+\\.\\d+\\.\\d+$"
        },
        "turnstile_site_key": {
          "description": "Production Turnstile widget site key (ADR-0028). Preview builds always use Turnstile's test key.",
          "type": "string",
          "minLength": 1
        }
      }
    },
    "pages": {
      "type": "array",
      "minItems": 1,
      "items": {
        "type": "object",
        "required": [
          "id",
          "type",
          "slug",
          "seo",
          "sections"
        ],
        "additionalProperties": false,
        "properties": {
          "id": {
            "$ref": "#/$defs/id"
          },
          "type": {
            "type": "string",
            "minLength": 1
          },
          "slug": {
            "type": "object",
            "x-localized": true,
            "propertyNames": {
              "$ref": "#/$defs/language"
            },
            "additionalProperties": {
              "type": "string",
              "pattern": "^([a-z0-9]+(-[a-z0-9]+)*)?(/[a-z0-9]+(-[a-z0-9]+)*)*$"
            },
            "minProperties": 1
          },
          "seo": {
            "type": "object",
            "required": [
              "title",
              "description"
            ],
            "additionalProperties": false,
            "properties": {
              "title": {
                "$ref": "#/$defs/text"
              },
              "description": {
                "$ref": "#/$defs/text"
              }
            }
          },
          "sections": {
            "type": "array",
            "items": {
              "$ref": "#/$defs/section"
            }
          }
        }
      }
    },
    "ctas": {
      "type": "array",
      "items": {
        "type": "object",
        "required": [
          "id",
          "type",
          "label",
          "target"
        ],
        "additionalProperties": false,
        "properties": {
          "id": {
            "$ref": "#/$defs/id"
          },
          "type": {
            "enum": [
              "call",
              "message",
              "email",
              "book",
              "quote_request",
              "consultation_request",
              "demo_request",
              "visit"
            ]
          },
          "channel": {
            "type": "string",
            "minLength": 1
          },
          "label": {
            "$ref": "#/$defs/text"
          },
          "target": {
            "oneOf": [
              {
                "type": "object",
                "required": [
                  "page"
                ],
                "additionalProperties": false,
                "properties": {
                  "page": {
                    "$ref": "#/$defs/id"
                  }
                }
              },
              {
                "type": "object",
                "required": [
                  "href"
                ],
                "additionalProperties": false,
                "properties": {
                  "href": {
                    "type": "string",
                    "pattern": "^(https://|mailto:|tel:)"
                  }
                }
              }
            ]
          },
          "fallback": {
            "$ref": "#/$defs/id"
          }
        }
      }
    },
    "forms": {
      "type": "array",
      "items": {
        "type": "object",
        "required": [
          "id",
          "form_type",
          "fields",
          "endpoint",
          "submit",
          "success",
          "error",
          "privacy_page",
          "privacy_notice"
        ],
        "additionalProperties": false,
        "properties": {
          "id": {
            "$ref": "#/$defs/id"
          },
          "form_type": {
            "type": "string",
            "pattern": "^[a-z0-9]+(_[a-z0-9]+)*$"
          },
          "fields": {
            "type": "array",
            "minItems": 1,
            "items": {
              "$ref": "#/$defs/field"
            }
          },
          "opt_ins": {
            "description": "Marketing Opt-ins shown on the form (ADR-0021): unticked, one per channel. M0 offers email only. The wording version is derived from the label text at build time.",
            "type": "array",
            "items": {
              "type": "object",
              "required": [
                "channel",
                "label"
              ],
              "additionalProperties": false,
              "properties": {
                "channel": {
                  "enum": [
                    "email"
                  ]
                },
                "label": {
                  "$ref": "#/$defs/text"
                }
              }
            }
          },
          "endpoint": {
            "description": "The production Worker endpoint. Preview builds can override it.",
            "type": "string",
            "pattern": "^https://"
          },
          "submit": {
            "$ref": "#/$defs/text"
          },
          "success": {
            "$ref": "#/$defs/text"
          },
          "error": {
            "$ref": "#/$defs/text"
          },
          "privacy_page": {
            "$ref": "#/$defs/id"
          },
          "privacy_notice": {
            "$ref": "#/$defs/text"
          }
        }
      }
    },
    "navigation": {
      "type": "array",
      "items": {
        "type": "object",
        "required": [
          "page",
          "label"
        ],
        "additionalProperties": false,
        "properties": {
          "page": {
            "$ref": "#/$defs/id"
          },
          "label": {
            "$ref": "#/$defs/text"
          }
        }
      }
    },
    "footer": {
      "type": "object",
      "required": [
        "text"
      ],
      "additionalProperties": false,
      "properties": {
        "text": {
          "$ref": "#/$defs/text"
        }
      }
    },
    "tracking": {
      "type": "object",
      "additionalProperties": false,
      "properties": {
        "gtm": {
          "type": "string",
          "pattern": "^GTM-[A-Z0-9]+$"
        },
        "ga4": {
          "type": "string",
          "pattern": "^G-[A-Z0-9]+$"
        },
        "consent_tool": {
          "description": "The certified consent tool (ADR-0020). Only integrated providers are allowed; see the M0 note in ADR-0020.",
          "type": "object",
          "required": [
            "provider",
            "id"
          ],
          "additionalProperties": false,
          "properties": {
            "provider": {
              "enum": [
                "cookieyes"
              ]
            },
            "id": {
              "type": "string",
              "pattern": "^[A-Za-z0-9_-]+$"
            }
          }
        }
      }
    },
    "redirects": {
      "type": "array",
      "items": {
        "type": "object",
        "required": [
          "from",
          "to"
        ],
        "additionalProperties": false,
        "properties": {
          "from": {
            "type": "string",
            "pattern": "^/"
          },
          "to": {
            "type": "string",
            "pattern": "^/"
          }
        }
      }
    }
  },
  "$defs": {
    "id": {
      "type": "string",
      "pattern": "^[a-z0-9]+(-[a-z0-9]+)*$"
    },
    "slug": {
      "type": "string",
      "pattern": "^[a-z0-9]+(-[a-z0-9]+)*$"
    },
    "language": {
      "type": "string",
      "pattern": "^[a-z]{2,3}(-[A-Z]{2})?$"
    },
    "text": {
      "description": "Visitor-facing text, keyed by language (ADR-0004).",
      "type": "object",
      "x-localized": true,
      "propertyNames": {
        "$ref": "#/$defs/language"
      },
      "additionalProperties": {
        "type": "string",
        "minLength": 1
      },
      "minProperties": 1
    },
    "section": {
      "type": "object",
      "required": [
        "component",
        "variant"
      ],
      "additionalProperties": false,
      "properties": {
        "component": {
          "type": "string",
          "minLength": 1
        },
        "variant": {
          "type": "string",
          "minLength": 1
        },
        "text": {
          "type": "object",
          "additionalProperties": {
            "$ref": "#/$defs/text"
          }
        },
        "ctas": {
          "type": "array",
          "items": {
            "$ref": "#/$defs/id"
          }
        },
        "form": {
          "$ref": "#/$defs/id"
        },
        "items": {
          "type": "array",
          "minItems": 1,
          "items": {
            "type": "object",
            "required": [
              "text"
            ],
            "additionalProperties": false,
            "properties": {
              "text": {
                "type": "object",
                "additionalProperties": {
                  "$ref": "#/$defs/text"
                }
              },
              "page": {
                "$ref": "#/$defs/id"
              }
            }
          }
        }
      }
    },
    "field": {
      "type": "object",
      "required": [
        "name",
        "type",
        "label"
      ],
      "additionalProperties": false,
      "properties": {
        "name": {
          "type": "string",
          "pattern": "^[a-z][a-z0-9_]*$",
          "not": {
            "enum": [
              "website"
            ]
          }
        },
        "type": {
          "enum": [
            "text",
            "email",
            "tel",
            "textarea",
            "select"
          ]
        },
        "label": {
          "$ref": "#/$defs/text"
        },
        "required": {
          "type": "boolean"
        },
        "autocomplete": {
          "type": "string",
          "pattern": "^[a-z- ]+$"
        },
        "options": {
          "type": "array",
          "minItems": 1,
          "items": {
            "type": "object",
            "required": [
              "value",
              "label"
            ],
            "additionalProperties": false,
            "properties": {
              "value": {
                "type": "string",
                "minLength": 1
              },
              "label": {
                "$ref": "#/$defs/text"
              }
            }
          }
        }
      },
      "if": {
        "properties": {
          "type": {
            "const": "select"
          }
        }
      },
      "then": {
        "required": [
          "options"
        ]
      }
    }
  }
}
